[
  {
    "id": "M001",
    "name": "Low-Sodium Chicken Adobo with Rice",
    "cuisine": "Filipino",
    "sodium_mg": 426,
    "carbs_g": 52,
    "calories": 466,
    "protein_g": 33,
    "fat_g": 14,
    "fiber_g": 6,
    "allergens": [
      "soy"
    ],
    "key_ingredients": [
      "chicken",
      "garlic",
      "vinegar",
      "rice"
    ],
    "diet_tags": [
      "heart-healthy",
      "diabetic-friendly",
      "renal-friendly",
      "gluten-free"
    ],
    "stock_qty": 8,
    "source": "kitchen",
    "reheat_method": "microwave"
  },
  {
    "id": "M002",
    "name": "Pork Sinigang with Brown Rice",
    "cuisine": "Filipino",
    "sodium_mg": 460,
    "carbs_g": 55,
    "calories": 528,
    "protein_g": 32,
    "fat_g": 20,
    "fiber_g": 8,
    "allergens": [],
    "key_ingredients": [
      "pork",
      "tamarind",
      "kangkong",
      "brown rice"
    ],
    "diet_tags": [
      "heart-healthy",
      "diabetic-friendly",
      "gluten-free"
    ],
    "stock_qty": 67,
    "source": "kitchen",
    "reheat_method": "microwave"
  },
  {
    "id": "M003",
    "name": "Chicken Tinola with Rice",
    "cuisine": "Filipino",
    "sodium_mg": 412,
    "carbs_g": 48,
    "calories": 414,
    "protein_g": 33,
    "fat_g": 10,
    "fiber_g": 8,
    "allergens": [],
    "key_ingredients": [
      "chicken",
      "ginger",
      "green papaya",
      "rice"
    ],
    "diet_tags": [
      "heart-healthy",
      "diabetic-friendly",
      "renal-friendly",
      "gluten-free"
    ],
    "stock_qty": 65,
    "source": "purchased",
    "reheat_method": "microwave"
  },
  {
    "id": "M004",
    "name": "Arroz Caldo",
    "cuisine": "Filipino",
    "sodium_mg": 465,
    "carbs_g": 57,
    "calories": 493,
    "protein_g": 28,
    "fat_g": 17,
    "fiber_g": 8,
    "allergens": [],
    "key_ingredients": [
      "chicken",
      "rice",
      "ginger"
    ],
    "diet_tags": [
      "heart-healthy",
      "diabetic-friendly",
      "gluten-free"
    ],
    "stock_qty": 59,
    "source": "kitchen",
    "reheat_method": "microwave"
  },
  {
    "id": "M005",
    "name": "Pancit Bihon",
    "cuisine": "Filipino",
    "sodium_mg": 531,
    "carbs_g": 63,
    "calories": 470,
    "protein_g": 32,
    "fat_g": 10,
    "fiber_g": 9,
    "allergens": [
      "soy"
    ],
    "key_ingredients": [
      "rice noodles",
      "chicken",
      "carrots",
      "cabbage"
    ],
    "diet_tags": [
      "heart-healthy",
      "gluten-free"
    ],
    "stock_qty": 40,
    "source": "kitchen",
    "reheat_method": "microwave"
  },
  {
    "id": "M006",
    "name": "Ginataang Gulay with Rice",
    "cuisine": "Filipino",
    "sodium_mg": 401,
    "carbs_g": 51,
    "calories": 425,
    "protein_g": 17,
    "fat_g": 17,
    "fiber_g": 5,
    "allergens": [],
    "key_ingredients": [
      "squash",
      "green beans",
      "coconut milk",
      "rice"
    ],
    "diet_tags": [
      "heart-healthy",
      "diabetic-friendly",
      "renal-friendly",
      "gluten-free",
      "vegetarian"
    ],
    "stock_qty": 99,
    "source": "kitchen",
    "reheat_method": "microwave"
  },
  {
    "id": "M007",
    "name": "Baked Bangus with Garlic Rice",
    "cuisine": "Filipino",
    "sodium_mg": 396,
    "carbs_g": 47,
    "calories": 436,
    "protein_g": 26,
    "fat_g": 16,
    "fiber_g": 8,
    "allergens": [
      "fish"
    ],
    "key_ingredients": [
      "milkfish",
      "tomatoes",
      "rice"
    ],
    "diet_tags": [
      "heart-healthy",
      "diabetic-friendly",
      "renal-friendly",
      "gluten-free"
    ],
    "stock_qty": 58,
    "source": "donated",
    "reheat_method": "microwave"
  },
  {
    "id": "M008",
    "name": "Heart-Healthy Beef Kaldereta",
    "cuisine": "Filipino",
    "sodium_mg": 542,
    "carbs_g": 43,
    "calories": 389,
    "protein_g": 34,
    "fat_g": 9,
    "fiber_g": 5,
    "allergens": [],
    "key_ingredients": [
      "beef",
      "potatoes",
      "bell pepper"
    ],
    "diet_tags": [
      "heart-healthy",
      "diabetic-friendly",
      "gluten-free"
    ],
    "stock_qty": 57,
    "source": "donated",
    "reheat_method": "microwave"
  },
  {
    "id": "M009",
    "name": "Chicken Afritada with Rice",
    "cuisine": "Filipino",
    "sodium_mg": 499,
    "carbs_g": 55,
    "calories": 427,
    "protein_g": 27,
    "fat_g": 11,
    "fiber_g": 9,
    "allergens": [],
    "key_ingredients": [
      "chicken",
      "potatoes",
      "peas",
      "rice"
    ],
    "diet_tags": [
      "heart-healthy",
      "diabetic-friendly",
      "gluten-free"
    ],
    "stock_qty": 72,
    "source": "kitchen",
    "reheat_method": "microwave"
  },
  {
    "id": "M010",
    "name": "Lumpiang Sariwa",
    "cuisine": "Filipino",
    "sodium_mg": 432,
    "carbs_g": 41,
    "calories": 339,
    "protein_g": 10,
    "fat_g": 15,
    "fiber_g": 5,
    "allergens": [
      "peanut",
      "gluten",
      "egg"
    ],
    "key_ingredients": [
      "vegetables",
      "wheat wrapper",
      "peanut sauce"
    ],
    "diet_tags": [
      "heart-healthy",
      "diabetic-friendly",
      "vegetarian"
    ],
    "stock_qty": 96,
    "source": "kitchen",
    "reheat_method": "none"
  },
  {
    "id": "M011",
    "name": "Chicken Congee with Scallions",
    "cuisine": "Chinese",
    "sodium_mg": 364,
    "carbs_g": 49,
    "calories": 503,
    "protein_g": 34,
    "fat_g": 19,
    "fiber_g": 9,
    "allergens": [],
    "key_ingredients": [
      "chicken",
      "rice",
      "ginger"
    ],
    "diet_tags": [
      "heart-healthy",
      "diabetic-friendly",
      "renal-friendly",
      "gluten-free"
    ],
    "stock_qty": 61,
    "source": "kitchen",
    "reheat_method": "microwave"
  },
  {
    "id": "M012",
    "name": "Steamed Fish with Ginger and Rice",
    "cuisine": "Chinese",
    "sodium_mg": 435,
    "carbs_g": 50,
    "calories": 435,
    "protein_g": 25,
    "fat_g": 15,
    "fiber_g": 5,
    "allergens": [
      "fish"
    ],
    "key_ingredients": [
      "fish",
      "ginger",
      "rice"
    ],
    "diet_tags": [
      "heart-healthy",
      "diabetic-friendly",
      "gluten-free"
    ],
    "stock_qty": 91,
    "source": "kitchen",
    "reheat_method": "microwave"
  },
  {
    "id": "M013",
    "name": "Vegetable Stir-Fry with Tofu",
    "cuisine": "Chinese",
    "sodium_mg": 497,
    "carbs_g": 44,
    "calories": 343,
    "protein_g": 17,
    "fat_g": 11,
    "fiber_g": 6,
    "allergens": [
      "soy"
    ],
    "key_ingredients": [
      "tofu",
      "bok choy",
      "carrots",
      "rice"
    ],
    "diet_tags": [
      "heart-healthy",
      "diabetic-friendly",
      "gluten-free",
      "vegetarian"
    ],
    "stock_qty": 47,
    "source": "kitchen",
    "reheat_method": "microwave"
  },
  {
    "id": "M014",
    "name": "Beef and Broccoli with Brown Rice",
    "cuisine": "Chinese",
    "sodium_mg": 571,
    "carbs_g": 51,
    "calories": 487,
    "protein_g": 28,
    "fat_g": 19,
    "fiber_g": 7,
    "allergens": [
      "soy"
    ],
    "key_ingredients": [
      "beef",
      "broccoli",
      "brown rice"
    ],
    "diet_tags": [
      "diabetic-friendly",
      "gluten-free"
    ],
    "stock_qty": 133,
    "source": "kitchen",
    "reheat_method": "microwave"
  },
  {
    "id": "M015",
    "name": "Mild Mapo Tofu with Rice",
    "cuisine": "Chinese",
    "sodium_mg": 607,
    "carbs_g": 52,
    "calories": 430,
    "protein_g": 33,
    "fat_g": 10,
    "fiber_g": 6,
    "allergens": [
      "soy"
    ],
    "key_ingredients": [
      "tofu",
      "ground pork",
      "rice"
    ],
    "diet_tags": [
      "diabetic-friendly",
      "gluten-free"
    ],
    "stock_qty": 135,
    "source": "kitchen",
    "reheat_method": "microwave"
  },
  {
    "id": "M016",
    "name": "Cashew Chicken with Rice",
    "cuisine": "Chinese",
    "sodium_mg": 516,
    "carbs_g": 46,
    "calories": 471,
    "protein_g": 29,
    "fat_g": 19,
    "fiber_g": 4,
    "allergens": [
      "tree_nut",
      "soy"
    ],
    "key_ingredients": [
      "chicken",
      "cashews",
      "bell pepper",
      "rice"
    ],
    "diet_tags": [
      "heart-healthy",
      "diabetic-friendly",
      "gluten-free"
    ],
    "stock_qty": 76,
    "source": "kitchen",
    "reheat_method": "microwave"
  },
  {
    "id": "M017",
    "name": "Shrimp Chow Mein",
    "cuisine": "Chinese",
    "sodium_mg": 617,
    "carbs_g": 61,
    "calories": 526,
    "protein_g": 30,
    "fat_g": 18,
    "fiber_g": 7,
    "allergens": [
      "shellfish",
      "gluten",
      "soy"
    ],
    "key_ingredients": [
      "shrimp",
      "wheat noodles",
      "cabbage"
    ],
    "diet_tags": [],
    "stock_qty": 47,
    "source": "donated",
    "reheat_method": "microwave"
  },
  {
    "id": "M018",
    "name": "Buddha's Delight",
    "cuisine": "Chinese",
    "sodium_mg": 457,
    "carbs_g": 49,
    "calories": 397,
    "protein_g": 21,
    "fat_g": 13,
    "fiber_g": 6,
    "allergens": [
      "soy"
    ],
    "key_ingredients": [
      "tofu",
      "mushrooms",
      "napa cabbage",
      "rice"
    ],
    "diet_tags": [
      "heart-healthy",
      "diabetic-friendly",
      "gluten-free",
      "vegetarian"
    ],
    "stock_qty": 111,
    "source": "kitchen",
    "reheat_method": "microwave"
  },
  {
    "id": "M019",
    "name": "Vegetable Egg Fried Rice",
    "cuisine": "Chinese",
    "sodium_mg": 521,
    "carbs_g": 62,
    "calories": 484,
    "protein_g": 23,
    "fat_g": 16,
    "fiber_g": 6,
    "allergens": [
      "egg",
      "soy"
    ],
    "key_ingredients": [
      "rice",
      "egg",
      "peas",
      "carrots"
    ],
    "diet_tags": [
      "heart-healthy",
      "gluten-free",
      "vegetarian"
    ],
    "stock_qty": 52,
    "source": "purchased",
    "reheat_method": "microwave"
  },
  {
    "id": "M020",
    "name": "Winter Melon Soup with Chicken and Rice",
    "cuisine": "Chinese",
    "sodium_mg": 354,
    "carbs_g": 45,
    "calories": 450,
    "protein_g": 27,